age,text,label
23,"film studies... ghost town creds mean i can scout cool movie set locations? but yeah only hope would be if people needed distraction - then boom, impromptu cinema from abandoned cars or something.",0
28,"""use time arguing bout personal life choices? nah just shrug""",0
29,big three-o doesn't always mean life's pieces fall into place. priorities aren’t one-size-fits-all; some never want kids or traditional careers paths! gotta consider different lifestyles out here too. ,0
22,rent struggles are no joke 😫,0
28,Went back to my hometown station recently—less paper tickets more touchscreens. Seemed super sci-fi vs old charm but guess it's efficiency over nostalgia now?,0
24,"kinda ironic, being into fashion design i've found hand sewing super therapeutic… like a chill zone away from all screen time! anyone else appreciate analog craftsmanship?",0
22,low pay but love being surrounded by books all day,0
27,"honestly think my field chose me more than i chose it - always been obsessed with nature regardless of the guy/girl ratio at uni. there’s room for everyone if you ask me, just gotta weather through those stereotypes sometimes lol",0
29,childhood hobbies =/= destiny; i chose notes over norms,0
25,def agree that hitting milestones doesn’t mean ticking off society’s todos - just more time playing your own game 🎮🚀,0
24,fashion design has its stereotypes too but thriving!,0
29,hate seeing those quirky little shops disappear for generic chains 😒,0
28,Automate savings - when income's high set transfers! Much easier than playing catch-up later on.,0
27,old arcade spot now serves artisan coffee — sworn they'd never leave pixels for beans. guess even geeks gotta grow up sometime lol,0
24,festivals here? strangers find 'em pretty extra sometimes 😂,0
21,gotta hustle alongside those lectures for real success,0
28,totally get you - followed interests over norms too!,0
27,Ancient artifact insurance premiums are no joke either!,0
25,Even off-peak ain't chill—metro's always crowded here. ,0
24,even biz admin studies show glaring gaps - frustrating times,0
27,yeah lowkey everyone expects you got your whole life sorted once you hit some magic number - joke’s on them cause we’re all just wingin' it,0
22,gender norms feel pretty archaic especially post-secondary education influence,0
27,even eating out feels like luxury now,0
22,quirky street poets by markets - surprisingly insightful stuff every time,0
23,tbh kinda tired of every corner turning hipster - feels like some places lose their soul trying too hard to be insta cool 🤷‍♀️ where's the realness at?,0
25,city bustle isn't just rush hour - teaches you timing and navigating through chaos like some real-life strategy game,0
25,Hard seeing places loaded with memories repainted into blank corporate canvases—cements just how much impersonal interests dictate our barrios now.,0
29,who doesn't love finding that rare vinyl at a flea market? also got mates into trading meals for piano sessions – turns out we're all trying to dodge those high notes in expenses!,0
23,started saving some cash every month now,0
26,seriously i keep surprising call center customers when i solve their tech issues stat...they sometimes ask for 'a guy who knows IT' 😆 gotta love breaking those molds every single day!,0
27,having someone around can make you pass on stuff sure but it also means having backup when things get rough - gives balance imo,0
23,performers are cool but graffiti art adds real flavor,0
27,"Question: How much does the weather influence your daily mood and productivity?

Question description: This might be a bit out there, but do you ever feel like your whole vibe for the day gets set by what you see outside your window first thing in the morning? For example, here we get these wild temperature swings sometimes – you're going to sleep with a chilly night and suddenly next day feels like someone cranked the thermostat. It throws me off completely, makes me wanna just camp out at a coffee shop with my laptop and chill instead of doing anything major. How about you? Do you get that urge to hibernate when it's cold or does a sunny day make you want to conquer the world?",0
21,"felt that too, always preferred drawing over sports",0
27,passion's great but stability doesn't hurt either,0
28,wow feels like trend everywhere huh used to chill at old record store now it’s just another pricey boutique city's losing its cool unique spots 😔,0
27,hah so debugging friends' bad wifi like some sorta connectivity guru... happens more often than you'd think!,0
26,"nah fam, having everything sorted is overrated anyway 🤷‍♂️ embrace those curveballs life throws cuz let’s face it – nobody truly has their act together... secret’s just owning your mess tbh",0
19,also doubles as free leg day workout every time you forget something upstairs,0
22,sounds optimistic - we'll see 🤷‍♂️,0
22,"still waiting for that ""adult"" click balancing study & work 😒",0
29,Networking helps but doesn't level playing fields always. ,0
23,frugal living's like that secret level-up trick nobody talks much about – gets you closer to those big boss battle dreams while keeping your wallet from rage quitting!,0
28,success could just skew your own lens too,0
24,beaches full of people crammed like sardines totally threw me off – expected roomy sands,0
26,always thought cities would feel similar - big reality check!,0
24,maybe they’re stocking up early lol,0
29,still gotta jump higher barriers sometimes,0
24,old spots getting face-lifts hits hard - charm's traded for modernity,0
28,"Heh, Tokio echoes similar sentiments—marriage talks intensify!",0
27,Museums often struggle too-heritage roles can be quite rigid!,0
28,Grew up surrounded by heritage yet chose global over local outlook!,0
21,everyone hyped up hitting those big milestone ages but honestly? just feels like extra stress nobody needs 🎯 pressures off when you ditch those deadlines anyhow,0
21,crazy seeing our chill spots turn techy huh,0
21,money talks sure but don't forget plenty artists out there making ends meet without sacrificing their vibes 🎨 hustling finds its way!,0
22,tbh sometimes you dont notice but those old city vibes can lurk in your stories like easter eggs - hidden but definitely there! 😆,0
25,always thought coding was just cool for anyone,0
29,thought numbers would be straightforward - surprise trend analysis & adapting models keeps me on toes!,0
25,pretty slick but does it run as good as it looks - all about them performance metrics tbh,0
25,"""A historian? More like survival expert during rush hour!""",0
28,"Yep, offices aren't fussed over typical alpha traits anymore!",0
24,"growth's cool, pockets ain’t ready though",0
24,so true! love ain't just finding someone special but also sticking together when things get real sticky 🤷🏾‍♀️ constant teamwork makes 'the one' more than just a fairytale guesswork,0
24,"fashion design's def seen as more 'femme' but let me tell you - that doesn't make things easier! still gotta fight for your spot under those runway lights, proving creativity ain’t got no barriers 🎨 gotta hustle whatever field you’re passionate about!",0
26,def seeing more ladies in forensics lately 👀,0
29,definitely feel you guys on evolving concepts of home - it's like wherever i'm doing meaningful stuff starts feeling more homely regardless of the noise or hustle outside. ,0
26,sometimes i catch ad layouts before reading articles - can totally point out where they messed up on alignment or typography! kinda ruins surfing online when you see all these 'faux pas' 😂,0
24,design flair might just trade well for those 'shiny' post-apocalypse essentials!,0
29,starter sourdough over start-up stress any day!,0
28,Tech sector here—definitely noticed less bias lately!,0
27,design gigs are all over the timeline too 🎨,0
19,honestly though isn't life more 'rinse n' repeat' than Hollywood hype?,0
27,Not just forensics; women curators are shaking things up here too!,0
19,history lesson might actually save ur love life 😂📚,0
27,def a love-hate thing seeing your hood become hotspot,0
26,creative work always hidden behind admin stuff,0
24,found an awesome rooftop garden café...urban escape plus great coffee!,0
24,yeah right... good luck with that ageing theory - more often you just end up with something bitter nobody wants at their party,0
28,real talk - it gets real deep when you plan a life together,0
28,Cutting out restaurant trips - now hosting matcha-making sessions; cheaper + cultural bonus!,0
28,Real talk - brainstorming DIY decor ideas become our thing now. It's like your brain gets wired differently when you're blending lives!,0
28,it's tons of choice & interest over pure chance tbh,0
26,art world’s similar - progress mixed with stubborn stereotypes,0
26,still gotta push through those gray days somehow 💪🌧️,0
24,rainy days = netflix & chill vibes 😌,0
27,definitely not just guys wanna bulk up_fit isn't one-size-fits-all,0
29,"kinda miss the old corner shops too, now it's just big chains everywhere... seems like we traded character for convenience. ",0
21,still kinda miss deep connections tho,0
22,got nada here...couldn't even guess my fav ice cream flavor 😑,0
23,totally get where you're coming from - less stress + managing time your own way hits different when you've got goals n stuff ,0
23,even coding gets stereotyped lol,0
19,seen stuff online about places back home too - think every city's got its own haunted hotspot people love to get freaked out by despite knowing better lol,0
28,always plan ahead now guess i'm a 'proper' adult lol,0
26,kinda relatable but found sticking close to creative roots even through unexpected changes keeps things fresh idk maybe blending old passions with new challenges probs helps also knowing when ya gotta pivot keeps it interesting 😌,0
29,totally get you - everyone thinks i default 'get' comp stuff cause i'm always behind a screen lol,0
28,lol analyzing ads becomes second nature at malls & insta ,0
28,Definitely felt shifts here too! Instead of clubbing or late-night hangouts I found joy planning future stuff together - feels weirdly satisfying actually! Anyone else got bit by the organizing bug?,0
28,Planning takes up more spare time now than ever – somehow digging into budgets for dream projects feels like leveling up in an adult version of The Sims!,0
23,had tape fix countertop once lol,0
24,schools maybe but work life? not so much,0
26,"every payday makes me feel slightly more 'adultish', especially juggling those bills 😪",0
19,sorry but idk if moving really changes things that much? sorta feels like you carry your old self wherever you go no matter the scenery swap 🏙️🔄🌳,0
29,cool points but higher income wouldn’t hurt either,0
27,"honestly, fame kinda exposes spots needing protection instead - heritage n' ecosystems gets forgotten too often",0
23,doubt i’d be scorsese useful unless we’re talkin' morale-boosting apocalypse screenings...,0
28,stability? more like predictability... gotta keep things fresh!,0
25,research papers sound brutal with all those edits - makes you wish for version control like git for academics huh 😂 at least there's that satisfaction when everything clicks though,0
23,"film's pretty mixed too, talent speaks louder than gender nowadays",0
27,"had something similar happen but instead of models, i was out doing fieldwork without enough soil sample bags - ended up using spare lunch wrappers 🌯 not super scientific but hey, data was collected!",0
28,Fell into analytics - surprisingly fulfilling despite early creative aspirations!,0
23,age doesn't automatically download life achievements though 🤨,0
19,economics homework kinda serves as my unexpected zen zone lol,0
24,"""settling down? nahh... busy levelling up life solo-style 😎""",0
28,"Love gets real when you’ve weathered enough storms together, not just sunshine dates.",0
28,"Travel's still on my wishlist too! Thought by now I'd explore every corner of Japan at least — reality’s got different plans tho doesn’t it? But hey, who knew adulting came with its own set of cool perks? 🗾",0
28,But sometimes nostalgic glances mask harsher lessons learned...,0
23,relationships ain’t a video game ya can’t just level up,0
27,those impromptu street art sessions though 👌,0
26,nothing beats volunteering at local events for me - sneak peeks behind scenes plus meeting cool peeps along the way! also helps you feel part of something bigger y'know? 😌🙌,0
22,people here start side-eyeing your bookshelf instead asking if you'll trade novels out for baby books soon 😬 #pressure,0
24,totally feel ya! less pressure now & loving creative freedom,0
27,research has lotsa women but leadership roles? another story 😔,0
25,sometimes catch myself narrating stuff like i'm leading a tour... weird!,0
28,"got pushed towards marketing - ""better fit"" apparently, didn't buy it",0
22,more room 4 deep-dives into political rabbit holes,0
23,new edit suite kinda feels like home now - cozy vibes amidst chaos tbh,0
19,every crumbling empire needed an economist to save their budget so don't knock econ just yet—it might just keep your future distopia from going totally broke!,0
27,design can feel restricting sometimes despite creativity peaks,0
19,film school vibes different - doesn't always match reality tho,0
27,yeah cool story bro but sounds like another case where people choose spooky over logic – anyone heard it misquotes can hack wifi too? lol,0
25,"rice cookers going off at midnight, rip sleep 😒",0
27,coastal walks here = underrated serene escapes,0
24,definitely see less diversity at coding meetups vs other fields,0
24,industry progress but stereotypes still not totally unstitched...,0
27,nah cutting out coffees > hunting for freebies,0
25,nailed some app features once but felt kinda meh later,0
24,"those ""whispers"" often lack real substance tho",0
26,yea its cool! guys also bringing fresh eyes into crime scene analysis now 👌,0
25,"lol can’t relate, gotta hustle at work rain or shine",0
27,Egyptian architecture too - female architects rising!,0
23,feels like everyone’s editor tailoring profiles tbh,0
24,late night cafe spots with impromptu jazz bands playing have their own special place... transforms your average evening coffee into something right outta movie scene! 🎷✨,0
21,graphic design feels pretty flexible gender-wise tbh,0
28,"While some find solace by water or mountains, for many urbanites like me who've moved away from where we started out - that bustling energy never really leaves you; it becomes a part of your essence.",0
21,society's expectations are overrated - express urself through art!,0
19,historical finds =/= ghosts but don't downplay their worth tho,0
22,those unexpected book exchanges popping up in phone boxes are everything - total treasure troves for a lit geek like me 📚😌,0
28,it's like some folks think 'data' means just charts - igniting change needs those narratives backed by solid stats though!,0
28,overcrowded? ever seen kilyos mid-summer? nightmare fuel!,0
22,ya always get funny looks making espresso shots better than dudes twice your size - guess strong coffee ain’t only made by strong arms! 🤷‍♀️ people need stop underestimating tbh,0
28,hr here lol supposed corporate spies but really just trying keep peace 😆,0
23,retail's tough too - sometimes i have ideas shrugged off till one of guys repeats them...frustrating much? gotta out-style them 😅,0
23,big city hustle inspired me but wallet says otherwise lol,0
27,honestly kinda ruins it for locals when small gems blow up - stuff gets generic real fast plus good luck finding anywhere chill without bumpin elbows nowadays,0
24,relationships are hard work but worth it imo,0
23,"commerce degree - expected numbers, got life lessons instead!",0
28,Crushed math stereotypes & landed happily in data analysis sector!,0
23,"man some alleyways here got crazy cool graffiti hidden like a secret exhibition only for those who wander off the beaten track, makes every walk feel like an art discovery tour!",0
27,cook at home - save cash & the planet 🌱,0
29,price tracking apps are game-changers nowadays!,0
28,"Sometimes diving deep into numbers can box you in career-wise, but landing a job analyzing trends let me merge passion for puzzles & practicality! And hey - who'd have guessed it’d translate well beyond just one city?",0
29,yeah those tiny old record shops tucked away are pure bliss too - nothing beats combing through classic vinyl finds then chilling out there lost in some Beethoven or jazz tunes!,0
21,dreams got bills now lol,0
21,ever noticed not many dudes at yoga classes? decided to give it a shot - flexibility’s no joke! kindda cool being the odd one out occasionally,0
26,once saw project budget blown on vintage kimono silk 🙊,0
28,solo living means more impulse berlin explorations for me,0
25,first solo budget session hit me hard – realizing you've got a handle on your own expenses outta nowhere...yeah that was my welcome-to-adulthood wake up call 😂,0
24,always mentally redesigning random ppl’s outfits while out... lol,0
26,nah overhyped tbh - same quirky latte art everywhere 🙄,0
24,who says settled equals better? 🤷‍♀️👀,0
22,budget diet started 'cause rent isn't cheap!,0
23,"everyone’s talking progress but honestly some folks still expect girls like me in fashion design just cuz “it’s feminine"" or whatever - times change slower than we think tbh",0
29,totally into vinyl records lately - thrift stores are treasure troves!,0
28,friends seem sorted... i call bs 🙃,0
27,can relate! juggling design projects & household needs definitely pushed me into grown-up mode quick 😬 ,0
26,time well spent crafting designs over buying stuff tbh 👌,0
23,owning property feels like winning lotto rn lol,0
19,personal ambition can outshine background sometimes,0
25,Maneuvered through life without much room for luxury - makes you appreciate what you got way more. Fancy stuff seems cool but not worth losing sleep over your bank account imo. ,0
28,Adaptabilities one thing; relentless work culture's another—boundaries blur easily.,0
25,"career stuff aside, flying solo definitely scores on low drama & heaps more me time - relaxing hobbies ftw",0
27,martyrs' day sounds intense but not exactly everyone’s cuppa... over here we ditch massive public gatherings for city-wide treasure hunts - talk bout old traditions getting a modern makeover!,0
22,can relate so much haha why lock life away when you're busy exploring new horizons? getting that degree while keeping up with bills means relationship stuff can wait  👀 there’s too much awesome stuff going on!,0
26,r.i.p old cinema turned bank 🏦 zero charm left ,0
28,"Sometimes ""upgrades"" feel soulless compared to memories. ",0
22,All that cash flow going into crystal balls when folks need real financial planning... Just goes to show how priorities can get all twisted!,0
29,finding those hidden parks where i can hear birds over traffic - perfect for defragging after staring at spreadsheets all day.,0
19,"one time had to use cling film as an emergency lid replacement during service - surprisingly snug fit so plates kept warm, customers didn't notice anything off 👍",0
24,"seen guys ace at embroidery here too, it's all skills over stereotypes now",0
28,Totally noticed—friends flipping vintage stereotypes constantly here!,0
29,design world’s just as bad - creative women often overlooked,0
28,it's tricky out here too – sometimes it feels like you gotta fix twice as many computers just fi get half di respect at work...trust me networking skills do come handy not just second screens or LAN parties but real talk breaking thru ceilings,0
27,"these myths kinda bond us together, giving everyone some collective goosebumps at night lol",0
19,studying econ isn't exactly serving tables at your local cafe but gotta pay those bills somehow right? probably gonna steer back onto course post-grad... we'll see where things go!,0
28,Diplomacy wasn't exactly standard choice back home—glad times are changing!,0
25,"loved hearing these takes…tour guides aren’t just peeps reciting facts! we’re storytellers breaking down history & culture every day – so yeah, not all dusty academics over here 😅 gotta keep things lively!",0
19,def more everyday compatibility n' respect than fate tbh,0
29,design world's subtle but yeah...same issues,0
24,more women in construction but still fight for equal respect,0
23,always ready for another rabbit hole on reddit,0
21,sometimes too much reddit over real hobbies though 😂,0
29,setting goals sounds neat until bills hit like ninja stars - plans need backup plans!,0
24,hype overshadows local charm tbh,0
26,fixed a bike tire first time - no youtube! felt boss 😎,0
19,physics sounds ace – props for sticking it out!,0
28,It's all about finding someone who complements your life journey now.,0
22,they always think i’m just there for light duties...nope!,0
27,local dive bar now artisan kombucha hub - times change!,0
22,"Question: Urban Gardening: Have you turned any tiny space into a green oasis?

Question description: as someone who's super into agricultural sciences (yeah, bit of a plant geek here), i've been experimenting with growing my own veggies on my tiny balcony. tbh, it's a refreshing escape from the concrete jungle life. managed to get some tomatoes and herbs thriving amongst the hustle of commuters and honking cars. feels like a little victory, you know? curious if anyone else has tried this urban gardening thing and what kinda green magic you've been able to conjure up in your own nook of the world?",0
22,dreamt big too – shelves over stock portfolios here lol,0
19,economics might come handy tho for post-apoc trade systems tbh,0
23,our old dvd rental spot turned into an artisanal cheese shop...talk about plot twist!,0
27,having eco dreams; ended up policy deep instead!,0
27,Over here it’s an immersion course in history one latte at a time! These pop-up cafés add dashes of old-world charm next to tech hubs - pharaohs meet filtered photos if you will. They’re definitely curated stories served up daily!,0
21,those tiny spaces really define our cityscape!,0
26,city vibes can jazz you up but some quiet time's essential too,0
25,memories matter but so does having a stability anchor imo,0
24,more women at work but equal pay? still not seeing it,0
29,rents go brrr makes you adult real quick 😂,0
28,Always found it cool mixing things up - aced math contests but enjoyed artsy hobbies too. Defying stereotypes wasn't intentional; just liked what I did!,0
24,crafting beauty with limits teaches resilience & innovation 👗💡,0
21,pretty sure i've become an unintentional clutter-free minimalist coz of work xd,0
22,cooking at home turned into fun hobby & saves ££!,0
29,so missed our indie theater scene - another condo now 😑,0
24,tourist money's nice but RIP authentic vibe 😩,0
27,"just say ""maximizing bachelorhood perks"" – dodge & win",0
25,life’s not just math formulas tho,0
24,still tearing up runways instead of playing fields!,0
29,yeah well tech ain't all rainbows either,0
23,if only great decor meant great espresso too!,0
28,Progress never asks permission—just reshapes memories. ,0
19,life’s more rough draft than final copy tbh,0
28,"yeah nightcanvas has a point but can't discount those childhood vibes setting up your whole 'life playlist', you get me? i def think those early beats play on loop in our heads sometimes 🎵",0
19,seen quirky pop-ups where iconic bakeries once stood,0
27,feels like money just vanishes despite all those savings hacks tbh,0
28,Cities instill a knack for navigating chaos elegantly.,0
27,miss the dusty bookstores replaced by chain cafes,0
27,retirement planning’s basically rocket science rn lol,0
28,Combo careers plus shared housework seem like Tokyo's new norm!,0
21,artisanal soaps? miss browsing those old comics tbh,0
26,gardening’s underrated tbh - saves tons & chills me out,0
29,diggin' into those second-hand shops helps big time! scored sweet deals on tech & clothes - reduces waste too 😉 found any treasures lately?,0
29,always thought that growing up around lots of old-school music vibes gave me patience and attention for detail – kinda ingrained respect for practice makes perfect without even realizing it!,0
29,"most think teaching music's chill, but try explaining Mozart’s influence on modern soundtracks to skeptical teens - it’s herding cats!",0
23,every time i think i’ve found some hidden spot downtown turns out everyone’s on instagram there already 😒 pretty sure those rocks have been tagged online too lol,0
24,haha yeah once i was convinced there was a serious drama going down cuz of all the shouty 'no's next door...turned out just binge-watching telenovelas 😅 loud tv nights are real!,0
19,thin walls + loud gamers next door = no sleep club,0
27,place got any old arcade machines? nothing beats nostalgia plus java when you gotta take a break from slinging code,0
23,"film editing used to be a guy's game, now we're all just tryna tell dope stories regardless of who’s behind the screen. feels good seeing barriers fade out like a vintage film transition!",0
26,"sure seems like there's a magic switch at 30 for ""proper"" adult stuff happening huh 😂 over here you're almost expected to have things figured out by then... doesn't help when everyone around starts throwing hints your way 🙄 kinda weird since we basically wing it most times anyway right?",0
28,Had similar experiences—gender never dictated my professional aspirations!,0
