age,text,label
56,strict timelines? more like stress recipes,1
56,Evolution inevitable; historic sites always layers deep!,1
55,Local hangouts used to have soul – even greasy spoons had character compared to these sterile new eateries popping up everywhere.,1
55,Engineering sure throws curveballs despite hefty spreadsheets!,1
55,Bold strategies needed beyond mere scrimping—history teaches us much. ,1
52,Heard similar dockside tall tales back home – mostly adrenaline meets eerie fog at play if you ask me. Lack of evidence says more than any ghost ever could!,1
56,Linear? More like a choose-your-own-adventure book! Mapped out plans often change - that ancient trade route becomes today’s interstate highway system; unpredictable yet full circle when viewed through time's lens.,1
53,"Took up ice hockey in a league recently - not many other ladies on the ice! It’s exhilarating, pushing past those stereotypes one slap shot at a time 🏒🚨",1
55,Twilight tours sound interesting but can get gimmicky. Prefer those small book cafes where literary buffs unite – real cultural exchange happens there. ,1
64,Midnight street food stalls here never disappoint – pure culinary adventure!,1
50,Star-gazing sounds great but networking events offer more diverse interactions!,1
68,Priorities mature like fine wine; substance over spectacle wins now. ,1
55,Adaptability's been clutch! Pivoted more times than anticipated; keeps life interesting at least – beats monotonous any day!,1
56,fixing stuff around the house does it for me - nothing beats unclogging a drain yourself without calling for help. sounds gross right? But once you’ve done it feels like mastering survival skills nobody thinks they’ll need 😉,1
52,Job relocations redefine home often for me.,1
53,"For me, it was when solitude became comfortable.",1
75,Financial prudence beats random hustles. ,1
54,"For me, true adult realization came when facing tough decisions alone - particularly health-related ones for family members; showed me weight of responsibility beyond personal goals.",1
55,ah metro rush hour - chef knife juggling skills come handy!,1
51,Wine festivals back home always echoed community over competition.,1
53,"Navigating streets, we thread through time's rich tapestry unseen. ",1
53,With every step up the salary ladder you'd think comfort would follow; fascinatingly oftentimes it's contentment that just gets harder to pin down.,1
56,Street performers > graffiti any day!,1
55,Circumstance informs but doesn't dictate character development.,1
60,Lifescript's always under revision; enjoy editing!,1
50,An astro PhD usually maps closely to academic/research-oriented roles - yet might lead some extraordinary folks elsewhere. For me? Universe exploration remains both hobby & job alike; teaching fuels it further. Always curious though–what unexpected orbits have others found themselves in post-graduation?,1
52,Despite nods towards inclusivity at surface level—real equity remains elusive; biases persist subtly even when overt barriers diminish.,1
53,Literature often leads culture - classic characters defying old norms now feel like harbingers of today's fluidity beyond fashion; they were signposts we’re only starting to follow!,1
62,New deadlines just rebranded old pressures. ,1
72,Simple once mandatory - now we label voluntary minimalism 'luxury'?,1
51,It's wild seeing even once-stuffy law offices go coworking spaces vibe now – espresso over evidence reviews!,1
52,"Like art conservation, love requires constant care and understanding. ",1
72,Roots run deep but we plot our course!,1
53,Libraries defy stale stereotypes; at least mine does. ,1
52,Shift visible—old guard’s mindsets? Not so much.,1
55,Social strategy overhaul beats kitchen experimentation any day!,1
66,retirement didn’t make things clearer; still figuring out tech etiquette...,1
55,"I hear you on that high after finishing a project, but ever dedicated months just for students to pass over your favorite course content? Bittersweet at best. ",1
55,stock up on normal stuff like coffee,1
52,Ironically being hitched meant upgrading tech skills due to more tech-savvy spouse pushing boundaries beyond previous comfort zones—not all changes shrink your world!,1
70,"Question: How have your favorite local spots changed over the years?

Question description: i can't be the only one who's got that one spot in town that just isn't the same anymore. Mine used to be this little bookshop where I'd spend hours just browsing and talking to the owner; now it's some kind of high-end gadget store. feels like all the character's been scrubbed off to make way for shiny things i don't need 🙄. got any places like that? tell me about your little corner of the world that’s had a facelift.",1
66,The charm of unique neighborhoods erodes under such homogenous expansion; cities should foster both heritage sites as reminders along their path forward – strikes me as urban amnesia otherwise. ,1
61,balance's key – gotta find ur zone,1
56,ghost tales = better sleepless nights? nope,1
55,seems every generation rewrites rules slowly,1
58,"Buildings may inspire us, but let's not oversimplify – economics & politics often steer our paths just as much. ",1
50,Academia's slowly welcoming more diverse faculty voices—change’s incremental yet hopeful. ,1
62,Stability isn't synonymous with stagnation – wisdom brings balance.,1
55,Mostly split bills down here too!,1
50,Fine-tuning work-life blend makes every year count – contentment's key!,1
64,Had sorta inverse experience - retirement made me rethink independence & adulthood completely; never-ending math problems turned into budget balancing acts!,1
50,Financial ebbs and flows teach resilience; planning trumps panic any day!,1
65,moved plenty times - same old everywhere you end up,1
58,"Diversity's up in trades too, still way slow though. ",1
55,driving around wasn't exactly childhood dream stuff but hey gets you talking with all sorts man kinda grows on ya plus bills won’t pay themselves right? at least picking your own music’s a win gotta find those small victories wherever we can,1
62,"hometowns do shape us but can't ignore some traditions needed updating, saw plenty first-hand over years at sea where some old ways don’t fly anymore – gotta adapt to stay afloat!",1
56,not everyone with exposure turns out great leaders though lotsa factors at play,1
52,Gloomy skies fuel lesson planning creativity!,1
58,Budgets today? More patchwork quilt than pristine symphony!,1
50,"Theorems don’t fill stomachs, yet they spark innovation.",1
56,Psych 'neutral'? Hardly saw any male nurses back then!,1
70,Peak hours? More like survival training!,1
55,Coping? For me—it’s diving into pages teeming with narratives amid still café corners.,1
55,Felt like navigating uncharted waters after decades when jumped back in! Both sides seem swamped by their own challenges; it's more multi-level chess than checkers out here!,1
65,I navigate pricey times by hunting deals - snagging essentials when they're discounted big time. It’s all about timing your buys; works like a charm every year during holiday sales!,1
58,Home really does become where your heart settles — sometimes it's not just one place but bits found along each chapter of your story. Adaptability becomes key!,1
52,Flashy facades don’t equate liveability – sometimes less really is more!,1
62,"Chasing culinary skills or cozy nights sounds restful but give me complex challenges any day! Engineering problems over recipes – it's all in designing one's definition of ""cozy,"" isn't it? Stability isn’t just staying put; it’s building something lasting. ",1
51,Law sector adjusting slowly; resistance remains. ,1
55,Mastered spreadsheets can be both art and science!,1
72,Sorry but old trinkets don't prove ghosts.,1
55,New hobbies together reinvent bonding!,1
72,Absolutely get where you're coming from - a heavy downpour and there goes my plan of being productive; instead it’s puzzles or rewatching old movies for me.,1
55,We go all out decorating cemeteries for Day of the Dead—talk about vibrant afterlife parties!,1
55,nah i gotta disagree here - sure some fields are making strides but overall? tons of outdated expectations still getting shoved on kids at school every day despite all our 'progress'.,1
51,Definitely strange—also worries me over unintended attention to residents' private lives!,1
60,Local pubs often host impromptu talks on city's lesser-known history - always enlightening!,1
52,Historic building scavenger hunts—hidden treasures around town!,1
58,Paying respects monthly at ‘Bank Altar’ since forever seems more like ongoing adulthood ritual than single wake-up call. Tough lessons learned early make sure you're never caught off-guard later!,1
50,More cash inflow doesn't dictate richer experiences or happiness. ,1
58,Ever thought schools get caught up in this too? Historical buildings are great until you're squeezed into outdated facilities trying to fulfill modern educational requirements - charming exteriors don't equate spacious classrooms or tech-ready spaces!,1
52,Personal growth keeps things fresh!,1
58,Mindset's key but parents' tune influences life's harmony too. ,1
52,Friends' expectations definitely escalate subtly.,1
56,totally get that feeling! where i'm from ramped up its tourism lately too - cool but weird seeing old spots crowded now,1
52,Sometimes just chilling at small neighborhood cafés gets you into impromptu jazz sessions – pure magic!,1
55,Hello everyone! Significant strides indeed; reminds me of changes post-WWII when wartime norms challenged traditional expectations—yet wage gaps show some attitudes linger like specters from past eras. ,1
55,Career evolution isn't bound by degrees - personal choice reigns supreme!,1
55,In driving gigs too--more lady drivers nowadays!,1
58,Invest wisely; quick cash infusions aren't financial panaceas.,1
67,Career adjustments often broaden one’s horizon beyond dated norms – an educator’s tale tells similar stories. ,1
68,Never too late for new beginnings or goals!,1
52,Varied spots yes but losing vital traditional community hubs has costs. ,1
50,Kite tech's fascinating though - lighter materials would've been game-changers back then!,1
58,Local fishing wharf - serene sunrise spot!,1
53,It's truly fascinating—and slightly eerie—how history lingers around corners we pass daily. Reminds me when digging through archival books revealed streets now lined with cafes were once trodden by revolutionaries; whispers from past manifest Lucidly among us!,1
56,Gone are 'sole breadwinner' days for sure!,1
50,Folks here secretly love their historic speakeasy tours—prohibition-era lore galore!,1
56,Even groceries feel like luxury items now!,1
65,Always thought growing up amid ancient landmarks mixed with modern hustle set me up for real-world toughness – left room for some flexibility around those firm roots though! Can’t just stick strictly where you started; adapting makes all the difference.,1
65,"Kite battles and dumplings? Interesting but common. We had annual marbles tournaments – serious strategy involved! Not everything old-school’s widespread knowledge or admired, though still cherished personally.",1
50,Post-collapse? Celestial navigation essentials could steer society anew!,1
55,nudged towards divorce 'cause late-night fares clash hard w/ family plans,1
52,"Question: Has a profession ever caused a rift in your personal relationships? If so, how did you navigate through it?

Question description: i’ve been thinking a lot lately about how we balance our work and personal lives... got heavy into this convo over dinner with friends the other night. personally, my job can be super intense, once had a partner who just didn't get the whole ""work late, grade papers, and prep research"" lifestyle, ended up feeling super disconnected. we split, but it was rough. know it's not just me – someone else out there must've had their work life bleed into their personal space, right? spill the beans, what went down and how'd you handle it?",1
65,Cooler days make for perfect ramen-slurping introspection time indoors!,1
67,Cafés doubling as book nooks amidst our bustling streets are pure gold.,1
53,Not big on scents personally—crammed shelves with dog-eared pages beats trendy cafés any day!,1
65,Even arranged meetings need nurturing—real solidarity!,1
70,city life toughens you up,1
70,Sunny days are prime – they rev up my engine,1
55,Bookshops spark curiosity; harsh winters build resilience though!,1
64,Some old corners survive among towers; memories persist subtly.,1
55,Adapting dining customs often unveils local history layers!,1
60,Local lore vs scholarly vetted can differ greatly!,1
70,Redesign? Why fix if ain't broken? Parks need preservation!,1
53,Boys' shock at girls acing woodshop class never gets old!,1
55,old-school skills > tech anyday,1
55,"Gotta add though, keeping track of guests digitally just makes sense now – think RSVPs at your fingertips! Plus everyone’s always on their phones anyway. ",1
53,Fashion week hustle? Preferring quieter library corners here!,1
51,Law grip stronger than expected - curves mostly bureaucratic shuffle and contractual puzzles!,1
52,Economic gains are one thing but let's not overlook prioritizing essentials over entertainment—especially during tough times. ,1
64,Teaching young ones calligraphy – art in every stroke!,1
72,BBQ invitations once meant handwritten notes; times change!,1
58,"Question: Expats and travelers of Reddit, how did your place of birth influence your expectations of other places you've visited?

Question description: So, there I was, backpacking through Europe, thinking every beach would be like the stretches back home — boy, was I in for a surprise! Turns out, the familiar coastlines I grew up with weren't the norm everywhere. Got me thinking about first impressions and expectations we carry from our hometowns. Have you ever been taken aback by how different a new place felt compared to the city or country where you were raised? Share your 'this is not what I expected' moment!",1
55,rain ruining a festa? please! turns it into an impromptu cooking feast under cover – nothing brings people together like good food when plans fall through. ,1
64,Always fascinating stumbling upon those quiet corners most pass by! There’s something special about old teahouses tucked away behind busy streets; they're like secret sanctuaries from urban buzz where time slows down – pure magic!,1
55,Catching all green lights today – my urban odyssey mastered!,1
72,"Had a colleague once categorize his lab mice as ""consultants"".",1
63,Those moments are just surface-level markers – real adulthood hit when facing tough ethical decisions alone at work; where outcomes rest on your shoulders alone... That’s when boy becomes man.,1
65,Honestly? Rainy days just make me roll up cosier at home—don’t get why everyone gets so down! Sunny out? Great! Lead grey skies... Mon Dieu 😒 time for tea and crosswords—not less productive IMO just different vibes!,1
52,Routine plus surprise rain equals peak productivity over here!,1
56,"Forgotten tales everywhere, especially in neglected spots!",1
65,Old police tales trump any spendy gadget buzz!,1
55,carpet washing festivals - kinda quirky!,1
72,Degrees help but real life teaches more!,1
65,Adaptation over preset plans – always been key!,1
65,Estate planning? Ha! More like infinite puzzles!,1
72,Math theory isn't job training – surprised pikachu face!,1
51,Had to staple together legal documents for urgent filing once—the printer broke down last minute! Quick thinking seems universal regardless of profession!,1
52,Career joy isn't tied to your chromosomes!,1
56,Iconic trattorias gone too - hello bland franchises!,1
55,Retro diner swapped for blockchain cafe – progress or parody?,1
55,Balance alone isn't enough; clear communication rules supreme. ,1
58,Psychology trumps logic with spooky tales. ,1
60,Modern shops overlay ancient samurai pathways here.,1
67,"Society indeed shifts; once-drawn lines between ""male"" and ""female"" hobbies blur more each year—teaching young minds has shown me openness blossoms well beyond past expectations!",1
72,Indoor activities bloom; life adapts regardless!,1
65,"old school here but listen - thinking you'll have it all sorted by 40's just another tall tale. retirement’s around and guess what? still figuring things out daily. nobody has all answers, regardless of how many candles on your birthday cake. ",1
55,"Historically speaking, 'the one' mythos was less romance-driven—more strategic alliances and property deals. Perception evolves drastically when you chuck tradition out; it becomes less destiny more choice-based matchmaking game where effort trumps fate every time!",1
58,Older times had charm but not always eco-smart—change helps!,1
55,Even post-recognition phases have battles—shaping policy or leading projects often becomes next-level hurdles marathon!,1
62,Granular knowledge paired with big-picture thinking builds stronger foundations—in structures and life.,1
62,"Not sure stale fears are fair game; stability breeds excellence too! Ever seen how majestic our old cathedrals still stand? There’s artistry in longevity — something deeply gratifying about honing your craft year after year, building your own legacy bit by bit!",1
70,Even amid relentless development here there’s still whispers about old smokestacks where we'd trade stories. Magic survives somehow!,1
68,"Question: Has anyone else found unusual ways to thrive after becoming suddenly single later in life?

Question description: You know, they say that life starts at 60, but tbh it kinda hit me like a brick when I found myself back in the single world some years ago. I had to reinvent my hobbies and social circles, which was not easy, but hey, at least now I'm a reddit pro and can stir a killer conversation online any time of the day. Gets me thinking though, how have others navigated the waters of late-in-life singleness? What creative or unexpected paths have you taken to keep things interesting? Share your stories, I'm all ears!",1
66,Institutional biases are deep-rooted relics from past societal structures—even academia wasn't immune. It required constant proving of competence beyond male counterparts'. Adaptation involved mastering nuances—language change had subtle yet profound impacts during peer interactions and publishing work.,1
52,"Pivoted from finance to HR - no regrets, fulfilling path!",1
60,all these fancy spaces...but do authentic chats happen still?,1
50,Commute entertainment's great until they pass around that hat – talk about unexpected expenses!,1
51,"Some folks find their peace in cafes; give me those obscure bookshops any day – shelves stacked with wisdom, silent except for rustling pages! These are true urban treasures where one actually learns tranquility amidst chaos.",1
72,"Had similar trials; respect wasn't freely given, was earned twice over. ",1
52,Flash floods here turn commutes into strategic ops!,1
56,stories like these are magnets for tourists where i’m from - rational thought often gets tossed aside when there’s a chance for some drama,1
55,Haha well sure! But let’s not get too carried away glorifying our jobs - history has countless tales where passion projects fulfilled lives much more deeply than any desk job ever could!,1
55,Totally counts! Preparing your own meals is like crafting life’s flavor palette—undoubtedly an art of independence. ,1
58,Christmas here? Beach cricket takes over every sandy spot!,1
55,"Ride-sharing booms during festivals here, gotta save extra then cuz slow months hit hard! Always track your fares & set aside something small daily – adds up quick!",1
63,Knitting's cool! Progress visible but biases linger. ,1
55,Work-life boundaries are like sandcastles; even when carefully crafted they're at mercy of tides! Navigating through requires honest communication—sometimes though differences remain irreconcilable despite best efforts.,1
56,Late-night flamenco dance offs - ceiling taps turn beats!,1
68,Running board meetings always reminded me how critical clear communication is - business jargon out; real talk in. Translates well beyond office walls into everyday life too!,1
51,Chain store invasions really gutting our neighborhoods' souls. ,1
56,honestly think settling isn't just because you're getting older – some folks still prioritize experiences over things no matter their age but hey everyone's different right,1
52,Hidden alleys often have best small galleries - never crowded!,1
50,But at whose cost? Gentrification isn't always neighborhood uplift.,1
62,Stood firm too—brigdes over bias!,1
55,Chemistry departments seeing similar shifts!,1
68,Personal dynamics are tricky beasts; slight shifts often go unnoticed initially. Found out over time who sticks around for you versus your wallet - eye-opening but valuable lessons learned. ,1
51,Heard weird sounds through walls once; turned out to be someone practicing kabuki! You haven't heard anything until you wake up to dramatic dialogue rehearsals at dawn...,1
62,“Clear words help but oversimplifying technical details risks misunderstandings.”,1
52,Passion often evolves; financial stability doesn't equate to sacrifice if you leverage all facets towards fulfilling pursuits within your field or hobbies.,1
52,Ever seen heated sidewalks? No shoveling – just pure genius!,1
55,Got the comfort but miss those wild dreams sometimes.,1
50,Even casual chats feel like character studies sometimes.,1
51,Swapped late nights for evening reads - absolute tranquility!,1
56,Local history tours uncover stories behind our streets' hustle!,1
52,It seems natural that time teaches us real substance beats fleeting thrills in a relationship – enduring companionship becomes priceless as years roll by. ,1
65,Garden veggies taste better than store-bought anyway!,1
52,Surprise factor fades; competence shines regardless of niche clientele presumptions. ,1
56,Diverse jobs help but can't erase deep-rooted traditions overnight. ,1
62,Structures stand before trade - priorities!,1
55,Surprises are cool but let's not forget solid teamwork – like acing a tough project together!,1
58,Textbook knowledge evolves into problem-solving post-crisis!,1
66,The state of our green spaces often mirrors societal disparities where resource allocation doesn't always reach those needing tranquil retreats most—equity remains essential.,1
52,Retirement planning? More like financial dart throwing!,1
52,Cultural impact isn't black or white - genes play a huge role too; just saying.,1
52,Old habits linger despite shifts; change comes at snail's pace.,1
52,Old hospitals tell stories - if walls could talk!,1
53,Cultural roots aren’t always visible; subtly influencing more than we realize.,1
61,ha! try matching that balance with our potholes here.,1
55,"oh man, talk about history and icy patches – here we lean into scooters but navigating cobblestone alleys in January? che pazzia! not to mention dodging tourists left n' right... got you wishing for nine lives sometimes!",1
55,"Yeah, there's something liberating about not having your happiness tied up in someone else’s hands anymore. You start digging hobbies you forgot you loved!",1
64,Our past colors our lens yet doesn’t paint our whole picture.,1
52,Definitely varies—timing isn’t everything!,1
60,Flexibility's key - some unscheduled events need tending beyond regular hours!,1
51,Crispy bacon scent alarm clock beats any ringtone hands down!,1
62,Post-collapse? Building expertise equals essential shelters first!,1
58,Absolutely! Sometimes even homework grading strategies help when organizing home chores – efficiency isn’t just for classroom management!,1
58,Definitely relate - felt triumphant when scheduling car maintenance without reminders!,1
68,Social gatherings sure feel different when you're picking up tabs!,1
63,Habitual pattern-spotting! Can turn any casual stroll through town into an impromptu history lesson relating buildings to eras—occupational hazard or quirky hobby?,1
53,It's intriguing when we start seeing our own narratives taking shape alongside those we read about... crafting mental blueprints for chapters yet unwritten perhaps?,1
55,budgets ignored turned my friend’s life upside down gotta watch out,1
58,Even win trivia night with budget strategy knowledge!,1
68,Roots plant seeds; choices nurture growth.,1
52,Stability doesn't equal stagnation; keeps things resilient. ,1
56,caring for others teaches patience and gives lots of perspective,1
52,Urban evolution isn't always regrettable. ,1
50,Both factors sculpt our personas; balance varies individually.,1
60,"Oh please, as if somehow reaching 30 flips a switch inside you making you ""adult"" overnight. If anything, it ramps up those annoying questions from everyone expecting you to have your life script sorted out already.",1
58,Every number cruncher knows things aren't valuable just because they're profitable – sometimes history and camaraderie trump a balance sheet!,1
60,Health focus intensifies even as work does; finding that equilibrium becomes crucial.,1
68,Found peace visiting parks; nature's pause button among skyscrapers.,1
53,Library visits over streaming – books offer endless worlds free!,1
50,Defied odds; never looked back!,1
55,Reflection Matters Most!,1
50,Seek respite in early morning rooftop stargazing; chaotic by day but serene by twilight.,1
63,word spreads quick in small towns,1
55,retirement sure forces you grow up fast,1
63,nursing had its stereotypes too - pushed through,1
