age,text,label
55,Holidays morphed into unofficial Kickstarter campaigns after hit a few career homers—gotta admire their creativity though!,1
51,"Complexity yes, but social dynamics shift too - deeper than age alone. ",1
60,Sure thing! Nostalgia has its charms but doesn't fully define us. Our origins leave imprints through traditions and interactions that go beyond rose-colored memories— shapes perspectives subtly. ,1
65,Feels like dodging boomerangs in retro arcade games!,1
52,"I hear you! Instead of playing time Tetris though, how about remote work days? They're popping up more often now – imagine sipping tea at home during rush hour instead of juggling elbows for space!",1
55,Definitely seeing more balance lately−diverse teams becoming norm rather than exception at board tables! Still hit snags of stereotypes sometimes though... change takes persistence!,1
55,past 30 they expect your cooking goes from experimental fun to nonna level skill overnight!,1
65,sure miss when shops felt special instead of copy-paste tourists traps – those mom-and-pop places had soul that you can’t buy off a shelf!,1
70,feeling at home ain't tied only to paying bills,1
55,Even high-level science sees stereotypes crumbling fast!,1
52,Shared histories pave stronger than solo tribulations build foundations too. ,1
51,Had to laugh when explaining contractual obligations during a family game night of Monopoly — those negotiation skills come handy even outside the office!,1
55,Now savor slow weekends with literature - pure bliss!,1
65,"romance takes work, just like wine-making",1
55,Hardly different really; life goals aren’t linear or universal.,1
62,time at sea makes you love quiet moments ashore like nothing else. spotting fishy deals comes naturally too after years of haggling over catches!,1
56,diversity's no magic pill though,1
55,goat racing huh? sounds wild! we don't do that but got different stuff involving animals makes tourists go 'what's happening?’ everytime lol,1
58,It definitely adds an extra layer when local lore alters actual behavior – who needs maps when you've got myths dictating routes!,1
55,In my field too change comes incrementally yet each step forward for inclusivity feels monumental – it’s uplifting when intellectual merit trumps old biases. ,1
65,"Even back then, some female colleagues showed unmatched sharpshooter skills!",1
62,Life milestone timelines are more fluid than we tend to think - seen plenty throw ‘ideal’ out the window chasing their dreams regardless of age!,1
51,Endurance beats serendipity for lasting bonds.,1
72,"It's ironic - spend years solving complex equations only for some folks thinking you're just ""good at math"" instead of recognizing your expertise and body of work!",1
50,Proactivity’s great but let's be real - tick-box diversity isn't turning tides fast enough; need deeper roots than just numbers at meetings.,1
50,Mural upkeep isn't free either!,1
50,Colonial-era balconies juxtaposed against glass panel high-rises —a stark reminder of our cities' evolving aesthetic narratives!,1
58,Try neighborhood gardens; oft-overlooked oases minus tour groups!,1
61,reckon everyone’s just winging it anyway; life throws curveballs no matter your age or plans mate,1
55,"ever heard of ""malanka""? dress-up like wild animals for new year!",1
63,Interestingly enough — not just your location influences reactions but generational changes! Attitudes are shifting gradually yet retired buddies around here sometimes still cling to old school beliefs when they see unconventional choices by younger gents. ,1
56,History's male-dominated; museums today? Much more co-ed vibes!,1
51,Often overlooked? Lifelong benefits sticking with your major brings. ,1
53,Still diving into books solo; some constants are golden!,1
58,Critical thinking trumps specific skill sets any day!,1
52,Stuck with scalpel — surgery's still central stage!,1
56,resilience sure but paperwork overload hardly inspiring,1
56,Art's cool but pays bills? Big question there.,1
60,Cultural roots run deep yet aren't destiny; think terroir influencing wine more than dictating its flavor profile outright. Growth intersects with past imprints in nuanced ways – evolution rather than overhaul. ,1
55,"kite battles? nice throwback! everyone's all digital now but nothing beats those old school vibes where hands got dirty—like mastering mom’s secret ragu recipe handed down for ages, every bit as thrilling!",1
52,Definitely gets creative here! Once turned a delay into an impromptu language lesson from fellow commuters - multitasking win!,1
65,"Academia wasn't immune to those shifts either; quite a few fields have seen significant transformation over time, Asian studies included.. At conferences now, compared to some years ago - more diverse voices leading sessions and research discussions. Real exchange of perspectives!",1
53,"Big fan of those ""time layer"" discoveries under our feet!",1
50,Times are changing - slowly but steadily.,1
55,Finding harmony over hitting stereotypes – key as years go by!,1
55,retirement hits you hardest – talk about adulting!,1
67,Necessities first; small joys keep spirits high!,1
58,Some gambles leave your portfolio needing life support though!,1
55,"Literature might not teach us farming or engineering, yet critical analysis hones strategic thinking—essential when reinventing society from rubble!",1
56,Exploring local free events can enrich weekends sans hefty price tags!,1
60,Local maker spaces - community ingenuity at its best.,1
52,It's quite poignant observing quaint cafes turning corporate; however these transitions often reflect shifting consumer preferences coupled with relentless rental pressures faced by small business owners.,1
58,It's fascinating to observe shifts happen firsthand; universities once had ironclad lecture styles now incorporate engaging social media too – conventions are truly bending.,1
52,Once used sterilized office staples for emergency skin closure!,1
55,splurged on white truffles for staff meal once - accountant lost it!,1
52,Market quirks make for interesting investment stories – bulk buys could signal someone capitalizing on holiday hype cycles. Niche markets have unique profitability!,1
70,Education leans female; leadership balance slower coming. ,1
50,"Had friends baffled at dinner when stars somehow aligned with oven settings—baking bread or observing celestial bodies, it’s all thermodynamics!",1
61,"Question: Redditors who've witnessed their hometown become 'famous' or 'infamous', what's your story, and how do you feel about it? 

Question description: Have you ever thought about how the place you were born can kind of shape your identity, even if tangentially? For instance, I've seen the city I was born in become quite well-known over time for its urban regeneration and a couple of natural phenomena, and it's so odd to see tourists snapping pics where I used to just walk my dog. Kind of makes me proud, but also a little protective, y'know? Like, that's my stomping ground you’re all Instagramming! How about you lot? Does anyone else feel a certain way when their sleepy little spot or even a bustling hometown hits the headlines or travel brochures? Share those tales!",1
68,Craft breweries replacing old corner pubs – bitter taste or refreshing change?,1
50,RIP quirky bookstores replaced by yet another soulless franchise coffee joint.,1
52,Cultural festivities often bolster local economies significantly. ,1
70,Bridges need sturdy foundations—just like love!,1
52,Seasoned bonds weather storms better than fresh flutters do.,1
50,Cooking's great but brain needs its own recipe for excitement!,1
58,Every student plot their own unique post-matric course.,1
55,Work-life synergy over balance; decide priorities wisely!,1
66,life teaches you - those rom-com sparks need kindling into lasting flames through thick & thin; reality's romance trumps fiction every day.,1
55,outsides shiny insides murky,1
55,spirits remind us too - can't ignore past whispers. ,1
55,Don't most 'surprise' investments flop? Tried once - booked a hot air balloon ride; turns out they hated heights. Lesson learned – research over romance!,1
62,Estimates hardly justify real consumption scrutiny though?,1
56,In progress but super slow here!,1
56,Passion shaped destiny; wealth wasn't the only marker. ,1
52,Can't deny formative childhood places linger subtly throughout life though!,1
55,"PhD labs are less ""boys' club"" now!",1
52,Often bonds deepen where cultural roots intersect – not just trials.,1
66,even delivery jobs weren’t free from those molds...trust me!,1
56,Rediscovered solitude's serenity–history books are evening companions again.,1
55,totally get what you're saying - your roots kinda tag along for life's ride! for me though? stories pack more punch when shared from behind the wheel meeting all walks of life; paints richer pictures beyond any hometown frame.,1
55,Cultural context also influences these dynamics significantly.,1
55,Strategies exist; revisiting life’s luxuries isn't futile. ,1
65,Term 'soulmate' always felt oversimplified; life taught me love’s intricate dance—some steps learned together can’t be choreographed by fate alone!,1
75,Still blueprinting every DIY project! Old habits stick around it seems.,1
55,Merit alone doesn’t always tip scales when bias runs deep. ,1
65,Kinda funny how people box us into old clichés!,1
52,Degrees don’t guarantee outcomes; real-world skills do!,1
53,Lesson prep mindset sneaks into trip planning – color-coded itineraries anyone?,1
52,At meetings they usually hand financial queries over thinking numbers are my jam – sure business school helps but seen plenty colleagues surprise everyone; it's all skill set not titles!,1
70,Crazy how funds get allocated sometimes! Once saw resources earmarked for investing in pigeon messaging systems - talk about old-school tactics meeting modern budgets!,1
50,Mostly good storytelling eclipses fact anytime. ,1
56,"diversity beats hustle, shapes depth over stress",1
61,"reckon our parent's ""right ages"" ain’t too practical now — costs are through the roof! you gotta play it as it lays instead of chasing old-school benchmarks that don’t really fit today’s world anyhow.",1
50,Nostalgia beats hype any day.,1
52,Hobbies not just relaxing—they spark growth too!,1
51,Life isn’t just romance—balance key.,1
58,Hardly surprising that geography dictates social norms—history has countless examples such as dress codes once challenging propriety now celebrated in art galleries!,1
52,"Question: How has the vibe of your birth city shaped who you are today?

Question description: grew up in this lovely historic city, not too huge but full of life, culture, and a certain gruff charm that I always think gave me my resilience and love for stories. it's weird how the energy of a place can kinda seep into you, isn't it? like, I can handle pretty much anything at work, and I reckon it's that early taste of a community that wasn't always polished but was real, y'know? what about you guys, do you feel like your hometown's spirit has worked its way into your personality or life choices?",1
52,Big city origins don't always define success; deliberate career moves play bigger roles IMHO. ,1
53,Balcony gardens? Pest invasion was real – turned mine into bug buffet!,1
55,Leveling up takes more than just intent! Engineers believe in precise measurements - applies to cooking too. Start simple next time; Master scrambled eggs before taking on soufflés! ,1
56,Real adulting hit me when faced with curating not just objects but their stories—responsibility beyond oneself cements that grown-up feeling. ,1
58,"Chur bro, you're spot-on! Where you grow up leaves its mark eh? Came up around blustery hills and political hustle—taught me grit and reading people pretty quick sticks! Shaped how I tackle daily slings n' arrows out there too.",1
50,Real milestone? When maximizing tax deductions became second nature; shows fiscal maturity more than coffee habits!,1
53,Interesting point! Careers often seem tied up with outdated notions of ‘who should do what’. Loved diving into literature - where passion led over roles – thankfully those old boundaries are getting blurrier every day!,1
64,Ever catch yourself involuntarily critiquing graphs in news articles? That's math teacher retirement for you – always evaluating accuracy!,1
62,pipes can't beat reel machinery clank at dawn,1
58,Inevitable truth—lifescripts often get rewritten!,1
52,Student loans became very real post-graduation. ,1
60,Taiko drums at dawn—communal wake-up call!,1
51,Feels great rekindling past passions—arguably best part of solohood!,1
70,Saw few ladies uptake high-level educational positions back then!,1
51,Trust me when I say modern dating apps are courts where social biases are often held as evidence - rarely ever just face value swipes.,1
53,"Understood completely! Strolled into library work more by chance than choice after studies – thinking it'd just be temporary. But digging into books daily? Surprisingly satisfying!! Sometimes stability beats chasing dreams that keep changing anyway. Plus, there's something special in finding joy where you never planned to look!",1
68,Career path ain't linear – embrace your unique journey!,1
55,Found stability beats constant unpredictability - balances out passions well. ,1
55,"Truth is ""sorted-out"" status = myth perpetuated by sitcoms. ",1
63,parks? more like doggy restrooms these days... always stepping over messes no one cleans up. lost a bit of charm tbh when you're on poop patrol instead enjoying nature!,1
52,It's all about creatively balancing cost without skimping on significance!,1
65,"Haha! Oh absolutely! Endless proofreading spills over – catching typos on menus becomes second nature when you've spent years grading papers! Plus, those late-night research sessions really turned me into quite the night owl – unexpected symbol spotting everywhere now too; can't help but connect patterns seen during leisurely strolls around town with historical trivia stored up there somewhere. ",1
55,Historic romances weren't linear either; they evolved through social struggles and triumphs — akin to forging steel; rigorous yet yielding something enduring. ,1
51,Hometown vibes matter but let's not forget personal choices & life events shape us too. It ain't just where you're from; it's also where you're headed &the pit stops along the way!,1
55,money talks in life for sure - driving does just that for me here but let's not forget passions outside work hours help keep us sane amid chaos of city streets!,1
56,"Tbh, these hidden courtyard cafes tucked away behind busy streets are where it's at! Total vibe shift inside—like stepping into another world where noise just fades out... gotta love finding spots like that when you least expect them!",1
56,gotta admit missing those easygoing mall days sometimes too,1
63,cherished bistros gone... pricey bistros take over,1
65,trust me no one’s life script is error-free,1
54,"Oh boy, talk how overworked docs supposedly have lousy handwriting! Honestly? Sometimes true—chart scribbles become our own cryptic shorthand when races against time are everyday marathons. ",1
57,Even academia harbors subtle biases under scholarly veneer.,1
55,A childhood surrounded by whispers of the past definitely leaves its mark - think it gives you depth and grit.,1
68,Practical biz skills - Like bartering - become crucial fast.,1
55,gonna chip in here - some folks wanna stack cash high as obelisco but for me? eating well & zero debt's the jackpot. think happiness ain't just bout pesos-counting... gotta find your groove!,1
63,"stereotypes everywhere, not just creatives",1
59,thrifting's cool but ever tried car boot sales? hidden gems everywhere & you meet some real characters selling stuff!,1
68,Seen both sides - Money magnifies personalities more than anything else!,1
50,Having the cosmos for company never gets old – setting up telescope nights has been magic! Not only mind-expanding solo but sparks some stellar conversations at local clubs too.,1
58,Revisiting old passions can be equally fulfilling!,1
54,I often catch myself giving unsolicited health advice or analyzing symptoms when friends or family mention feeling under the weather – occupational hazard!,1
52,Rebuilding society needs healthy individuals as much as organized governance - meds and diplomacy should walk hand-in-hand post-collapse!,1
50,Artisan cafes everywhere - barista knows more than banker now!,1
55,Coupon clipping turned into adult treasure hunts!,1
68,Education’s just part foundation; grit builds careers.,1
64,"Gotta say, sometimes rose-tinted glasses blur the less quaint realities.",1
51,Still boxed in by old-school academia expectations sometimes!,1
50,Navigating market constellations requires a bit of astronaut training nowadays!,1
53,Growing up amidst Moscow’s historical grandeur certainly colors tales I spin – glimpses of Tolstoyan landscapes might sneak into chats more often than you'd think!,1
58,Working closely with young minds reaffirms daily that growth's possible at any stage – an outlook much needed at times!,1
50,Career aligned; life interests diversified. ,1
51,Sociedad's stuck in tradition loops… seems arbitrary?,1
60,Definitely think we're oversimplifying things a bit here—compatibility matters too! It takes more than weathering storms together; similar values and continuous growth are huge deals for long-term harmony!,1
55,selling hand-knitted beanies online did wonders for me!,1
50,"Interesting how despite clear scientific temperament here, any eerie mention still causes intrigue amongst even skeptics.",1
68,Adaptability became second nature over time. ,1
52,Modern design lacks classic pub camaraderie. ,1
58,"Real talk - overseeing prom made me feel super adult-like. Balancing student expectations, budgets & safety concerns? Talk about multi-level adulting!",1
55,Transit woes mirror bureaucratic stagnation—time for modern policies!,1
52,Growth together shouldn’t be underestimated either. ,1
72,Compromise matters but don't lose yourself. ,1
60,Romantic ideals definitely transform; real connection grows through shared challenges over sparkle-eyed moments.,1
63,"parks need better care everywhere, not just select areas",1
55,Spine-chilling stuff during late-night campus strolls!,1
52,"Question: Ever felt like moving transformed your life? Share your story!

Question description: Isn't it wild how a change of scenery can totally flip your life script? I moved for my dream job and it's been a rollercoaster – ups, downs, the whole shebang! Before, I often spent weekends exploring local lanes and soaking in the urban buzz. Now? Well, let's just say that my social media feed's had a bit of a revamp with the new views. Anyone got tales of how moving shook up their world? Any unexpected twists? Let's swap stories - the good, the bad, the downright weird!",1
62,back when i was living closer quarters had neighbors who thought their karaoke skills were top-notch... they weren't – sounded more like cats squabbling at midnight!,1
50,Electric engineers are pegged as indoor cave dwellers soldered to their desks - true for crunch times but we thrive problem-solving out 'in the wild' too.,1
72,Communication's key but so are common values.,1
53,Finding literary themes in everyday life! Seems Tolstoy & Dostoevsky follow me home more often than not...,1
51,"Even ""unicorn"" startups can’t justify crystal-infused water coolers. 🙄",1
65,Art world's just as skewed—constant fight for recognition!,1
55,"Drive people, not stereotypes – our cabs got no room for 'em!",1
63,Every generation redefines milestones – stay true to your journey.,1
50,"Ah yes, although games like 'tejo' do provide fun times; they're threads in our rich cultural tapestry — growing brighter as we continue to weave innovation into these age-old pastimes!",1
52,Medicine's shifting too – still skewed but less every year.,1
65,Traits evolve; they're not just relics from past locales. Ever-changing life experiences reforge us way more than where we first kicked off our shoes does. ,1
55,cute coding gigs but isn’t that just glossing over bigger wage issues? 🤔,1
52,Bulk-buy essentials online - bigger discounts plus time saved!,1
52,Not just money—traditions weave social fabric too. ,1
52,"""Algorithms often mirror societal biases – skewed 'fairness' isn't surprising.""",1
50,"Fascinating how these stories persist! We've got similar whisperings back home about ""shadowy figures"" roaming college campuses at night - enough to make some take longer routes just in case!",1
53,Post-divorce found me diving back into classic literature circles online—my own kind of salsa dance! Personal reading lists are now longer than ever though; didn't see that coming!,1
72,Couldn’t agree more—being shaped by your roots much like core math principles guide you initially. Then life throws variables at you!,1
68,Once bustling malls now host weekend farmers' markets – signs of times!,1
63,Fire alarm foodies; unpredictable cooking makes stairwell meet-ups routine... not fans!,1
55,"Question: How do you manage to keep life fulfilling with a modest income in an increasingly expensive world?

Question description: so just scrolling through my news feed and checking all those fancy new gadgets and vacations spots can sometimes be a bit too much, right? kinda makes me nostalgic for simpler times… anyway, my friends and i were talking about how living on a tight budget can actually lead to some pretty creative living. it's almost like a game sometimes, trying to find the best deals or come up with new ways to have fun without breaking the bank. i've even got into gardening, believe it or not, helps with the grocery bills and it's kinda therapeutic. how do you guys make the most of things when money's tight? got any life hacks or feel-good stories to share about thriving on a shoestring?",1
67,The landscape surely evolves! Teaching had its own stereotypes – often feminine-associated professions here actually produced fine male educators too who brought balance & fresh perspectives just like other sectors are witnessing now!,1
58,Neighborhood fairs outshine traditional school fundraisers there nowadays; times evolve!,1
53,Interesting point! Same shift here; used to see mostly women in my field too – now it's all talents on deck regardless of gender. Seems we're all part of a broader change beyond our own spheres!,1
58,The bike anecdote hits close to home- even amongst educated circles there still lingers an air for 'appropriateness'. Not long ago a colleague eyebrow-raised over women leading certain academic departments; some preconceptions take generations to fade away.,1
55,every day i see another classic resto bar getting replaced with some soulless fast food joint... feels like they're erasing our history piece by piece just to sell more papas fritas y hamburguesas – es un bajón total.,1
55,"impressed by your 'chill vibes' thing but let me stir the pot - grew up amidst pizza scents doesn't make you masterchef when you leave la bella Napoli! we adapt, evolve & mix those childhood spices with new flavors over time👨‍🍳",1
52,Environmental influences early on shouldn't be underestimated though; they lay foundational perspectives even if later choices diverge from them.,1
62,Engineering seemed like solid ground – ended up more like navigating through quicksand at times! Theory’s one thing; real projects toss all sorts of curveballs your way. ,1
56,Diversifying’s great if you've got enough hours in your day!,1
56,Save all you want but life throws curveballs! Like huh? Where'd my rainy day fund go? Got hit with back-to-back medical bills once - it was tough!,1
65,Gray skies do invite introspection—perfect for losing oneself in a good book or diving into historical research. It's almost as if time slows down; ideal for scholars at heart!,1
52,Observing interactions outside class feels second nature; social dynamics don't clock out. ,1
55,Feels like trading soul for tourists sometimes.,1
52,Funding cuts often hit park maintenance first - unfortunate reality. ,1
67,Definitely more packed lunches and walks in local parks lately!,1
51,Still plenty of old-school mindsets out there—change isn't uniform! ,1
70,used to drive buses full house men only hard thinking back,1
58,Matching socks - feels oddly satisfying!,1
55,Not just a numbers game; sustained presence & repetitive proof seem essential even if tiresome!,1
60,"Retrospectively speaking, even seasoned navigators rarely sailed without adjustments. Financial planning resembles cartography—constantly mapping uncharted territories each year; you're normal!",1
53,Paperwork's massive but let’s not forget - dealing with bureaucracy can be crazier than fiction! Not heroines chasing drama but more like jugglers at a non-stop circus act.,1
53,Switched all bulbs at home to LEDs; upfront cost pays off fast! Also found library events are not just free - they're fun social replacements for pricier outings. Plus swiping books beats buying any day when saving pennies matters!,1
55,seen plenty change on these streets too - like lady cabbies handling rush hour like champs while dudes are crafting up a storm selling handmade soap at fairs – times sure are changin'.,1
63,“ever consider surprise healthcare expenses? total budget killers!”,1
