age,text,label
55,"Had a similar moment during budget reconciliation when Excel crashed. With minutes left before the meeting—thank you calculator app and back-of-the-envelope scribbles! Got praised for ""old-school efficiency."" Sometimes retro is your best co-pilot!",1
62,Used coffee stirrers once for temporary beam support!,1
60,Most never realize the layers beneath today's streets. ,1
53,So much more than dust collectors! Libraries offer digital loans too – totally free classics AND latest releases! 📚,1
51,"Nostalgia aside, not all changes spell progress.",1
70,All those sports contests... back home we valued street chess matches! Strategy over sweat any day - brains thrilled where brawn couldn’t reach!,1
58,City hustle teaches resilience; markets teach diversity – both valuable lessons!,1
55,Surely there's merit in artistic spaces drawing people together but don't you find it equally interesting how every brick laid also carries stories of challenges faced? Creating always has another side — overcoming struggles often goes unsung compared to final shine.,1
56,Natural? Sure sometimes – but let’s not pretend every change is for the better! Finding balance can be tougher than restoring frescoes after centuries of wear; you lose some pieces along the way. ,1
55,Historical finds give credence only to past events – equating these discoveries with ghosts stretches reality considerably. Legends thrive on ambiguity after all. ,1
63,"free outdoor galleries? more like havens for serene moments away from all that noise! sometimes you'll see me getting carried away people-watching or lost in my own world with a book near some forgotten statue... its charm never ceases, even when your wallet's thin!",1
56,Comparing salaries ignores individual needs & satisfaction levels like apples ≠ oranges 🍎🍊,1
64,Hometown influence overrated; more complex than just where you're born.,1
56,more like budget gymnastics than hunting lol,1
52,Interesting takes all around! But let’s not forget determination & personal growth often transcend where we're kicked off. Where you start doesn't always dictate where you end up – plenty rise above circumstances they’re born into; led by ambition more so than geography.,1
65,"""Secrets exist if untagged online!""",1
58,Life isn't linear—it’s a personalized journey for each person. ,1
52,Relocations reshape comfort zones; work often redefines 'home' parameters.,1
55,Cloudy skies remind me of lore-filled days indoors—timeless feeling.,1
50,Been giving unsolicited traffic advice at parties... autopilot!,1
62,Stuck with structural integrity over here – though each project throws curveballs you'd never learn about just hitting books! Keeps things spicy even when on paper looks like I followed life's blueprint!,1
55,Historical layers add depth to every cornerstone we encounter.,1
55,Earning patterns aside; autonomy & career fulfillment count too!,1
55,Inflation dances circles around paychecks; austerity becomes an unintended hobby. ,1
53,Kinda miss those homemade toy boot races!,1
50,Roamed into an alley last week; bumped into an indie vinyl shop—totally didn't expect such rich tunes quietly spinning away midst high-rises!,1
63,miss crafting paper maché piñatas!,1
61,markets foster mateship better than skyscrapers,1
68,Strategic thinking ain't obsolete either!,1
56,so salsa classes count? cuz nailing steps = major win,1
55,These rigid milestones undoubtedly bypass the unique rhythms at which our lives unfold - adhering strictly feels increasingly outdated as we recognize personal achievements can span beyond conventional time frames. ,1
65,tech makes it easy but nothing beats an old-school invite in your hand feels more like someone actually wants you there,1
50,Spare bedrooms eventually turn into home offices instead of just storage for backpacks – gotta love adulting! ,1
56,Hobbies are hit hardest now; creativity doesn't pay bills.,1
53,Brushes aren’t just ‘delicate hand’ tools!,1
50,Definitely relates - flexibility turned out key!,1
55,Cultural nuances also shape these dynamics quite subtly–dating behaviors aren't just influenced by gender but also diverse heritage aspects often intertwining invisibly within our social interactions. ,1
58,It’s vital we safeguard communal spaces amidst growth.,1
65,Coin-operated gachapon machines dotting side streets – everyday artistry often overlooked.,1
50,Seek serenity? Try early morning walks before crowds swarm - blissful!,1
52,Tick-box life events don't equal fulfillment or success. ,1
53,Classic overestimation at book store rearrangements; presumed helper turned out organizer!,1
50,Galaxies blend gravity with stellar chaos - much like identities.,1
50,"Heritage brings solace, yet bills await.",1
52,HR isn't just paperwork - we're often part-time therapists at work!,1
52,Med school straight into surgery here; life's scalpel cut clean!,1
62,"Morning walks are nice in theory but overlook one thing - construction never sleeps! That ""blissful"" walk can quickly turn into navigating around noisy building sites.    ",1
58,Degree plans vs career reality – classic chalkboard eraser scenario!,1
55,Our psyche isn't just layered paint echoing original shades—sometimes entire segments get repainted altering former hues beyond recognition as life experience dictates—and history backs this up!,1
52,Emotionally draining days mean less energy for home life. ,1
58,Winter's mint here; defo keeps you on your toes!,1
55,Big picture thinking sounds great until you're knee-deep in actual change – balancing finances alone can flip any zen plans upside down!,1
50,Folks here still treasure book-filled soirées where discussions dance as lively as on any vibrant Parisian street – endlessly fascinating for some!,1
62,Old towns with their engineering marvels taught me balance - embracing innovation while holding onto tradition isn't easy but it’s worth every effort!,1
59,endurance ain't dullness - even seasoned relationships got their own spark,1
55,Kulturschock ist real – city vibes differ wildly!,1
62,ever heard karaoke till dawn? welcome to my world,1
55,wow imagine doing grocery runs on that day lol,1
55,Surprisingly educational delays; turned one wait into history trivia exchange!,1
52,Shared growth and challenges forge stronger bonds than mere initial thrills.,1
62,Milestone deadlines? An impractical blueprint at best.,1
53,So many stories where careers take unplanned yet satisfying routes! Love hearing these plots twist better than some novels - bet yours would make quite the page-turner too!,1
53,It does shift over time indeed – for me it's less about matching others' earnings but more like evolving needs anchoring that 'good enough'. Security replaces splurging at some point. ,1
50,Genuine enthusiasm rarely wears a mask.,1
50,"Start hitting those finance milestones and boom – suddenly everyone's your 'long-lost' cousin twice removed needing cash advice or a ""small"" loan. Family gatherings feel more like networking events lately!",1
56,Seeing more male nurses and female surgeons lately - stereotypes are fading fast!,1
50,Explosive urbanisation isn't kind—housing woes just tip the iceberg here!,1
56,Still seeing old biases even today... sigh.,1
66,psychic readings over solid stocks? wildcard much!,1
55,Sustainability over spectacle?,1
58,Seems visions of meritocracy fade quickly under academia's lamp too – novel ideas often judged by their author's cover rather than content quality within my field’s hallowed halls.,1
52,"""Timelines vary like patient recovery rates – individually tailored.""",1
62,sea’s always been part of me dudes,1
56,"Charming antique markets now gone, replaced by sterile mini-malls. Sad progress. ",1
60,Rising costs demand strategic financial gymnastics nowadays.,1
50,Totally hear you on seeking equilibrium—been through phases where margins & markets ate into 'me' time; finding hobbies disconnected from KPIs actually refueled my analysis game later!,1
63,definitely felt that french touch stick with me,1
65,Weather variations are interesting but barely affect indoor routines!,1
58,It's real – had to prove worth beyond just being 'el jefe'.,1
52,Can’t generalize — upbringings are diverse!,1
50,"For some of us, throwing ourselves into our careers isn't just comforting—it's strategic too. ",1
75,It’s not just shops—remember those old cinemas? Now you get multiplexes everywhere instead of that one-of-a-kind movie experience we had back then.,1
50,Observation from academia—students evolve uniquely; their success defies standard benchmarks just as much as mine has. ,1
57,And here I thought tech would make sense by now...,1
53,Earnings up - savings game should level up too!,1
51,Independence rocks yet has its ups and downs - growth’s in navigating those waters.,1
52,"Question: What's something you wish you knew about relationships when you were younger?

Question description: It's funny how hindsight is 20/20, isn't it? I once thought my happily-ever-after was a given, but turns out, it's a bit more complicated 😆. Looking back, there's a heap I'd tell my younger self, especially about maintaining individuality while sharing a life with someone. It's like, you need to have your own hobbies, friends, and time apart to keep things fresh, you know? What insights would you go back and give to your younger self about relationships?",1
55,nighttime street food tours - gastronomy heaven!,1
63,"Gravely miss quaint antiquaries, now flashy boutiques abound.",1
55,Cultural norms shape our expectations just as much as app algorithms do. Seen plenty debates where historical contexts are disregarded which can explain current trends more than just swipes or matches ever could!,1
53,Fascinating turn of events for you! It reminds me again that embracing where life takes us could beat rigidly following outdated ambitions. Who knows? Had we pursued our initial dreams - may not have been as rosy after all!,1
56,Life's full of trade-offs; perks weren't even on kid-me's radar.,1
68,Sorting's like budget management—underappreciated art until mastered!,1
53,Interesting points all round! But do you think certain deep-rooted expectations remain? Literature circles still raise eyebrows when genres get mixed up - those classics hold their stereotypes tight!,1
58,Coastal upbringing instilled adaptability – waves of change!,1
52,"Yeah, it's wild how our horizons keep evolving! New builds definitely shake up rent but often bring buzzin' community spaces we didn't have before – swings n' roundabouts?",1
62,"i hear ya - grew up around boats n' nets myself. had its charm but life wasn’t all calm seas and sunny shores if ya catch my drift? even after years out at sea everytime i see those familiar coastlines it feels nostalgic yet always reminds me that progress doesn’t mean forgetting our roots, just learning from 'em!",1
51,"Preferring shared playlists & mutual growth charts to fairy tales these days - love's more mixtape than movie script, each track a choice not chance!",1
55,Commercial vibes kill authentic local gatherings!,1
55,artisanal markets every weekend though - real treasure troves!,1
57,Academia isn't immune either - often there’s pressure conforming more towards 'traditional' scholarship than novel perspectives which may not fit old-school molds. Breaking through means celebrating small victories when pushing forward under-recognized topics or methods!,1
55,Pros outweigh cons IMO - city vibe's livelier now!,1
52,Farmers' markets are neat but watch out for overpriced 'artisanal' stuff. Local products? Sometimes just clever marketing!,1
56,Nurses aren't saints; just coffee-powered humans!,1
55,Beware extremes - consider Renaissance polymaths embraced varied interests avoiding undue fixation on singular pursuits! Balance indeed fosters long-term engagement across all activities.,1
66,even retirees notice old workplace biases,1
50,Noticed empty lots around once bustling areas turned into vibrant community parks—like a live-action “we need more greenspace” campaign realized suddenly overnight!,1
50,I reckon growing older refocuses us toward depth rather than breadth - creating rich tapestries of local experiences instead of collecting distant postcards. Collaboration between wanderlust spirit and nestled comforts isn't myth; one complements other like nuanced flavors in well-seasoned cuisine we enjoy mastering over time!,1
53,Seen it firsthand - traditional expectations still lurk in corners even amongst progressive strides. ,1
55,"Indeed, layers from our past often anchor us firmly; however profound personal moments equally mold 'home'.",1
51,Wind alone doesn't make you tough. Other challenges mold resilience too. ,1
53,Winter cycling? Basically an ice ballet minus grace...and tutus!,1
55,"Honestly, it hit me when taking out our first home loan — staring down those numbers made everything super real!",1
55,Suddenly bills made grades look like playtime!,1
68,Certainly resonates. Exposure to various walks of life in one's early years can indeed carve out an appreciation for diversity; it makes us global citizens before we even realize it—embracing differences becomes second nature. ,1
53,Implying all local customs forge identical values seems overgeneralizing - doesn't account for personal interpretation or resistance against those very norms we grow up around!,1
70,rainy days are perfect for some house tinkering or diving into my hobby pile keeps the mind sharp,1
60,Traditions aren't static—they adapt over time. Can't we find new ways for these practices that honor our past without compromising future sustainability?,1
55,Embroidery relaxes me more than CAD!,1
55,Bavarian beer tents? Unexpected elegance abroad!,1
50,Pocket dimensions found in rush hour!,1
66,planning? more like perpetual detours at every corner!,1
55,Travel definitely broadens horizons! Once expected everywhere to share familiar academic enthusiasm like at home – quickly learned it's not always a universal thing ;),1
52,Big grey clouds totally zap my energy. More coffee days!,1
62,"In my line of work too, more women are stepping into roles once dominated by men. However old habits die hard—some meetings feel like time travel back to '80s vibes!",1
70,experiences trump place born huge time,1
50,Original roots ground you amidst urban chaos. ,1
50,Not gonna lie—it's spreadsheets over speed dating these days! Diving deep into complex financial puzzles sure beats awkward dates. Plus side? No one judges your coffee intake when you're your own company!,1
55,seen businesswomen multitasking like champs daily,1
58,First staff meeting as principal really sealed it.,1
65,Expertise often overshadowed by old prejudice despite proven records.,1
55,ran my shop for years dealing with suppliers always doubting cuz im mujer had to play hardball show em business knows no gender just smarts & grit,1
50,Advanced gear or not – without skills & tactics? Just stylish losers. ,1
58,"Truth be told, seen prestigious titles overshadowed by these norms too – like your ""less mainstream"" perspectives aren't given due weight unless it fits their mold.",1
55,Cobblestone stillness whispers tales old as time itself at dawn indeed.,1
65,Mateo taught me long ago - harvests are like retirement plans; you predict all you want; still gotta adjust when it hits different.,1
60,Perception often trumps reality in matters of wealth versus contentment. ,1
55,Definitely fewer eyebrows raised at hobbies breaking old norms now too!,1
55,sure throwing parties for veggies sounds weird but ever heard people hanging red underwear outside for good luck? twists everywhere,1
56,not just about balancing - city life needs slower rhythms too,1
52,Big-city hustle definitely leaves its mark – busy lifestyle ingrained!,1
56,Felt it when having to make all decisions alone – bittersweet freedom for sure!,1
66,Funding preserves precious cultural vignettes stitched into our daily lives. ,1
55,"Oddly enough, literature paved unique paths beyond just teaching!",1
56,definitely feels different now trying make ends meet - times change right? found some joy picking up cooking at home rather than eating out...boosts savings too!,1
55,Efficient yet cost-prohibitive?,1
66,Typical narratives oversimplify adulthood complexities. ,1
52,Absolute figures obscure reality—costs of living adjustments crucial; six figures differ greatly between cities like SF or Austin.,1
55,En las mías no hubo rascacielos pero se desinfló igual - each journey unique tho!,1
50,More like unraveling Gordian knots every month!,1
55,Crazy how CAD shortcuts pop up when texting!,1
58,Trusty binder clips once doubled as emergency zipper fixes during graduation day robes panic! These little clutch moments keep jobs exciting - educators need their ingenuity too!,1
52,Creative habits can refine mastery—comfort doesn't equal stagnation.,1
65,"Planning's one thing, life's curveballs another!",1
55,Totally see where you're coming form! Literature infiltrates every aspect of our lives more than one might think—like recognizing life imitating art when folks unwittingly recreate scenes straight outta classics at parks or cafes. ,1
55,"Careers rarely follow straight textbook narratives, do they?",1
60,Curie was exceptional indeed but not all can rely solely on raw talent; often navigating academia's subtler biases needs strategic networking combined with undeniable expertise – challenging yet doable!,1
53,Definitely noted these trends affecting academic circles too.,1
53,Catching myself giving impromptu advice!,1
63,"Oddly enough, our streets are lined with plaques recounting historic moments -- like free lessons where you least expect them!",1
60,last time our tram got stuck everyone just complained nonstop till we could move again... not all delays turn into fun & games ya know?,1
50,Wealth often reveals underlying insecurities and can strain friendships; observed plenty among colleagues post-promotions.,1
58,Even small breaks can significantly recharge amidst organized chaos.,1
52,Health insurance suddenly a hot topic at family dinners!,1
55,In every tech team meeting there's sometimes an old-school head who mistakes assertiveness for aggression if not coming from a guy—time for another update!,1
60,"Cultural roots can't simply be swapped for programming—it's not binary! Both kite-making artistry instilling finesse, patience & code-teaching logic are crucial. It cultivates well-rounded growth.",1
68,In high-stakes meetings empty ink pens morphed into pointers – crucial for presentations when traditional tools failed us!,1
55,"Love stories aren't scripted - they're lived, written across years not scenes.",1
60,Grocery receipts are modern horror stories!,1
65,Crowded spaces taught me eyes in the back of my head!,1
55,Can't ignore the charm of those old haunts; they had character. These shiny new spots are neat but miss that vintage vibe. Noticed how every block seems like a clone now? Originality’s taking a hit with each renovation it feels like.,1
50,Cities evolve like galaxies—finding quiet corners mitigates yearning for past simplicity. ,1
51,Law degrees open doors - not just legal ones!,1
72,Mindset adapts - birthplaces don’t define your whole story. ,1
53,In layers beneath dialogue or character quirks in storytelling sessions at home often lie echoes of those monument-lined boulevards and parks filled with silver birches – subtle imprints shaping narratives even when crafting universes miles apart from Red Square whispers.,1
53,Surprised peers when fixing library tech more often than male co-workers!,1
53,Surely there's progress - but also smoke and mirrors sometimes? Cultural narratives change outfits quicker than substance does!,1
65,Embracing change builds character - old beats meeting fresh beats!,1
58,"Question: Redditors, how have your expectations of gender roles evolved over time?

Question description: i remember back in the day how there were these pretty rigid ideas about what guys and gals were 'supposed' to do, like it was straight outta some 1950s sitcom, ya know? but growing up, and especially while working in education, i've seen attitudes shift quite a bit. still feels like we've got a ways to go though. lately, i've been wondering how everyone's perspectives on gender roles have changed. Have ya noticed a shift in your own thinking or in the community around you? Let's hear some stories - have any of these changes impacted your life decisions or career path?",1
55,"Gotta admit though, those smartphones also put libraries in our pockets – ironic too since now more folks read up even while sipping lattes at those very cafes!",1
52,"Stability's valued sure, but even long-term relationships need those unexpected moments—that spark—to keep things vibrant; it’s not always black or white.",1
53,Literature circles here also evolving beyond old norms – definitely refreshing!,1
63,trust me you're not alone but playing too loose with cash could backfire - seen enough oops moments in my time!,1
55,It's kinda like watching your kid grow up – proud of the progress but missing those quiet moments together before they hit every milestone known to social media.,1
70,city life’s hustle was simpler back then less dodging more chatting,1
53,Funny how nobody thinks librarian when they see me but guess turns heads at trivia night when literary history questions pop up!,1
70,"Not quiet though—real connections demand effort, like old buses.",1
52,Despite strides toward equality we've made here up North - like increased female surgical residencies - certain operating rooms can feel stuck in past eras at times; change isn't uniformly distributed just yet!,1
55,Always talking politics even when off duty - occupational hazard!,1
50,Home’s not just physical – it travels with you.,1
62,Heritage lays the groundwork much like bedrock does for architecture; sure you can redesign but those original blueprints often guide your rebuilds more than you think.,1
52,Winter commutes are super tricky - gotta dodge icy sidewalks after hopping off trams that feel like sardine cans! Carrying extra socks became life-saving advice someone gave me once.,1
63,Diagnosis becomes second nature—spotting symptoms at family dinners!,1
50,"Rediscovered passion for analysis—markets don't sleep, nor does curiosity!",1
51,No doubt growing up around innovative minds and disruptive tech feeds into your hustle mentality out here – resilience is key!,1
55,"ya know those moments after a downpour when streets get all quiet? feels almost sacred here che - everything just shiny & still for once, gives you time to breathe even if it's crazy busy most times",1
55,barrio looks totally unrecognizable now... every corner's changed,1
55,Observations over decades reveal shifts towards merit-based opportunities regardless of gender—echoes perhaps from when Enlightenment thinkers began challenging traditional hierarchies; similar undercurrents undoubtedly navigate today’s educational spheres.,1
65,distinct old bookstores we had here are now rare gems,1
65,Pipes sang better than neighbors once 😂,1
50,Totally get you! Navigating market trends often feels more like art than science.,1
50,Nostalgia has its charm but clinging too hard means missing out on shaping those new ‘nooks’ in life!,1
65,Books? More like window sills props nowadays – thank thrift shops!,1
50,Not just vibes - rents skyrocket too!,1
52,"""Milestones vary more than patient symptoms - timetables irrelevant.""",1
60,Financial clarity ≠ Life mastery,1
64,Dinners alone hit different when they're unintended - used long hours crafting lessons much like composing code; connection takes effort!,1
52,Got to say as someone who’s no stranger to scalpels outside movies – medicine skills are pretty apocalypse-proof. From stitching up wounds without modern equipment to identifying which plants might just save you from an infection - it’s hands-on survival 101!,1
53,Dreamed less of bank balance highs & more abt shelves bending under classic lit 📚 Life’s twists? Sure. Surprised by joy found in pages rather than pennies!,1
52,Essential breathing room against skyline silhouettes!,1
54,Age comes with shifting expectations but those aren't universal markers for everyone's journey – each path differs.,1
55,Diversity exposes us; personal reflection determines our growth.,1
56,Library's a godsend! Started homebrewing coffee too—bye-bye café splurges!,1
62,"Gotta love progress but even as an engineer appreciating innovation, finding moments for a breather keeps you sane amid all that buzz.",1
55,Interesting perspective! Seen both sides - some places exactly echo hometown vibes while others toss those expectations right out the window!,1
50,Ever dove into spreadsheets for fun? Being unattached turned that oddity into weekend thrills for me – ironic hobby for an analyst! Sometimes it’s not just financials getting balanced.,1
70,Teaming up sure beats going at it alone; truer bonds are forged in fiery trials than calm seas! And let’s not forget—a bit patience often unlocks even greater things together. ,1
55,"Partner tried getting me into her yoga routine – quickly realized my idea of stretching does not involve twisting like pretzels every morning! We now respectfully decline each other’s ""relaxing"" hobbies.",1
55,Literature departments too — barrier-breaking enrollment these days!,1
58,Ambitions should still spark personal growth!,1
70,stability's key sure but even old engines need sparks sometimes otherwise what keeps 'em running?depths great for sailing ships but without some wind you’re stuck idle can’t forget fun’s role even later in life,1
